{
  "schema_version": "buy-wait-decision/v2",
  "policy_version": "buy-wait-policy/v2",
  "trace_id": "sha256:dddddddddddddddddddddddddddddddddddddddddddddddddddddddddddddddd",
  "context_digest": "sha256:eeeeeeeeeeeeeeeeeeeeeeeeeeeeeeeeeeeeeeeeeeeeeeeeeeeeeeeeeeeeeeee",
  "raw_context_retained": false,
  "outcome": "WAIT",
  "selected_offer_ref": "offer:synthetic-wait",
  "selected_product_ref": "variant:synthetic-wait",
  "current_price_decimal": "120.00",
  "currency": "EUR",
  "history_samples": 8,
  "tracked_days": 14,
  "current_percentile_decimal": "1.000000",
  "decision_confidence_decimal": "0.900000",
  "backtest_profile_ref": "backtest:buy-wait:v2:synthetic",
  "future_observations_used": false,
  "reason_codes": ["current_price_materially_high", "historical_backtest_policy_passed"],
  "claims": [
    {"claim": "current_price_percentile", "value": "1.000000", "evidence_refs": ["price:synthetic:2"]},
    {"claim": "historical_median_price", "value": "100.000000", "evidence_refs": ["price:synthetic:2"]},
    {"claim": "decision_confidence", "value": "0.900000", "evidence_refs": ["confidence:synthetic:2"]}
  ],
  "evidence_refs": ["price:synthetic:2", "confidence:synthetic:2"],
  "result_digest": "sha256:ffffffffffffffffffffffffffffffffffffffffffffffffffffffffffffffff"
}
